First Name,Last Name,Title,Company Name,Company Name for Emails,Email,Email Status,Primary Email Source,Primary Email Verification Source,Email Confidence,Primary Email Catch-all Status,Primary Email Last Verified At,Seniority,Departments,Sub Departments,Contact Owner,Work Direct Phone,Home Phone,Mobile Phone,Corporate Phone,Other Phone,Do Not Call,Stage,Lists,Last Contacted,Account Owner,# Employees,Industry,Keywords,Person Linkedin Url,Website,Company Linkedin Url,Facebook Url,Twitter Url,City,State,Country,Company Address,Company City,Company State,Company Country,Company Phone,Technologies,Annual Revenue,Total Funding,Latest Funding,Latest Funding Amount,Last Raised At,Subsidiary of,Subsidiary of (Organization ID),Email Sent,Email Open,Email Bounced,Replied,Demoed,Number of Retail Locations,Apollo Contact Id,Apollo Account Id,Secondary Email,Secondary Email Source,Secondary Email Status,Secondary Email Verification Source,Tertiary Email,Tertiary Email Source,Tertiary Email Status,Tertiary Email Verification Source,Uses ML 2140 0418164738,Qualify Contact
Brian,Gill,Chief Technology Officer,DAT Freight & Analytics,DAT Freight & Analytics,brian.gill@dat.com,Verified,Apollo,Apollo,"",Catch-all,2026-04-15T09:43:54+00:00,C suite,"C-Suite, Engineering & Technical","Information Technology Executive, Engineering & Technical, Technology Operations",simbaaa.1205@gmail.com,"","","",'+1 800-547-5417,"",false,Cold,logistics_people_gap,"",simbaaa.1205@gmail.com,950,transportation/trucking/railroad,"fleet management, fleet compliance, truckload capacity, freight matching, saas, broker tms, logistics, enterprise solutions, freight market analytics, transportation management, software, trucking, transportation, freight rates, loadboard, dot & insurance monitoring, digital freight matching, truck transportation, b2b, freight rate volatility, rate benchmarking, market trends analysis, freight rate data, supply chain optimization, freight futures, trucking market data, freight operations, operational efficiency, freight visibility, market analysis tools, load matching, transportation & logistics, transportation capacity forecasting, carrier network, transportation data, freight benchmarking, digital freight futures, data analytics, freight transaction data, automated freight matching, supply chain resilience, logistics solutions, freight futures trading, freight rate trends, transportation analytics, freight market modeling, transportation operating authority, freight market risk management, freight cost analysis, capacity planning, freight market data, information technology, carrier safety insights, freight marketplace, transport management system, real-time tracking, logistics capacity planning, digital freight marketplace, freight rate prediction, freight transportation arrangement, market intelligence, truckload rate analysis, freight rate benchmarking, market trend forecasting, industry trend analysis, market forecasts, services, truckload marketplace, freight management, freight & shipping, logistics automation, freight transactions, consulting, freight market simulation, freight pricing analytics, digital logistics platform, carrier insights, capacity optimization, carrier safety data, freight rate analytics, big data, truckload rate benchmarking, freight pricing, freight payment solutions, real-time freight tracking, automated freight solutions, logistics data, satellite tracking, machine learning, market volatility analysis, freight exchange, freight transaction platform, freight visibility platform, transportation industry analytics, cloud computing, digital freight platform, freight rate comparison, freight data platform, tms integration, freight futures contracts, load board, freight data, market trends, data-driven decision making, truckload rates, freight management software, market forecasting, supply chain analytics, industry insights, freight market insights, predictive analytics, real-time data transmission, logistics technology, e-commerce, finance, manufacturing, distribution, computer software, information technology & services, transportation/trucking/railroad, enterprise software, enterprises, artificial intelligence, consumer internet, consumers, internet, financial services, mechanical or industrial engineering",http://www.linkedin.com/in/briangill,https://dat.com,http://www.linkedin.com/company/dat-freight-and-analytics,https://www.facebook.com/datfreight,https://twitter.com/datfreightteam,Seattle,Washington,United States,"Portland, Oregon, United States",Portland,Oregon,United States,'+1 800-547-5417,"Route 53, Gmail, Google Apps, Cloudflare DNS, Rackspace MailGun, Amazon AWS, WP Engine, Atlassian Cloud, SumoMe, Hubspot, Zendesk, Slack, Salesforce, CloudFlare, Webflow, New Relic, Greenhouse.io, reCAPTCHA, Google Analytics, Vimeo, Varnish, Segment.io, Cedexis Radar, FullStory, JQuery 1.11.1, Google AdWords Conversion, Google Play, YouTube, DoubleClick Conversion, Google Maps (Non Paid Users), Bing Ads, Nginx, Google Maps, Visual Website Optimizer, DoubleClick, Pardot, Pingdom, WordPress.org, Wistia, CallRail, Google Tag Manager, CrazyEgg, Hotjar, Facebook Login (Connect), Facebook Widget, Mixpanel, Google Font API, Linkedin Marketing Solutions, Adobe Media Optimizer, Bazaarvoice, Twitter Advertising, Facebook Custom Audiences, Amadesa, Mobile Friendly, Bootstrap Framework, Google Dynamic Remarketing, AI, Aircall, Remote, IoT, Datadog, Wider Planet, Laravel, PHP, Javascript, TypeScript, React, Amazon Managed Streaming for Apache Kafka (Amazon MSK), RabbitMQ, NetSuite, NetSuite OneWorld, NetSuite SuiteScript, NetSuite SuiteFlow, Lytics, Snowflake, Stampli, Microsoft Dynamics GP, SQL, Power Query, Salesforce Sales Cloud, Salesforce Revenue Cloud, Flow, React Native, Node.js, GraphQL, PostgreSQL, AWS Analytics, Apache Kafka, AWS Trusted Advisor, dbt, Airflow, Python, Excel4Apps, Google Sheets, Looker, Tableau, Power BI Documenter, Docker, Kubernetes, Azure Analysis Services, IBM ILOG CPLEX Optimization Studio, Sales Cloud Einstein, Salesforce CPQ, SOQL, LeanData, Dialpad, Tor, Vscode, Amazon EKS Anywhere, Amazon S3, Jira, UKG, Confluence, AVRO, Apache Iceberg, go+, Akamai Connected Cloud (formerly Linode), GRPC, Terraform, HELM, Google AlloyDB for PostgreSQL, Dash, Pulumi, .NET, Amazon DocumentDB, Argo, Microsoft Office, Vtiger for G Suite",300000000,"","","","","Roper Technologies, Inc. (ropertech.com)","Roper Technologies, Inc. (ropertech.com)","",false,false,false,false,"",69e3b861b006300011fb7858,69e3b1e466680b00010cc108,"","","","","","","","","",""
Jason,Westigard,Chief Product & Technical Officer,Trax Technologies,Trax,jason.westigard@traxtech.com,Verified,Apollo,Apollo,"","",2026-04-06T18:59:50+00:00,C suite,"","",simbaaa.1205@gmail.com,"","","",'+1 800-755-0110,"",false,Cold,logistics_people_gap,"",simbaaa.1205@gmail.com,250,logistics & supply chain,"freight & audit payment, supply chain management, data management, transportation spend management, decision management, visibility & analytics, rate management, transportation spend analytics, business intelligence, artificial intelligence, consulting, transportation, logistics, supply chain & storage, retail, enterprise logistics, transport spend analytics, data normalization, global logistics solutions, logistics cost visibility, multi-country freight management, supply chain transparency, inventory management, transportation & logistics, logistics data enrichment, normalized logistics data, cost savings, supply chain automation, transportation data insights, cost optimization, logistics cost analysis, risk management, supply chain analytics, information technology & services, transportation risk management, transportation data management, global freight data, supply chain efficiency, freight cost benchmarking, freight invoice analysis, global supply chain visibility, logistics cost reduction, manufacturing, b2b, carrier compliance, freight audit, engineering services, ai-driven logistics, cost control, enterprise freight management, operational efficiency, compliance management, carrier data compliance, multi-modal transportation, freight invoice normalization, real-time insights, healthcare, services, global freight data integration, logistics performance, ai decision-making, logistics data normalization, supply chain performance, invoice accuracy, software as a service, regulatory compliance, ai-powered freight audit, supply chain disruption resilience, ai for logistics, carrier relationship management, logistics data analytics, data compliance, freight data management, carrier management, cost reduction, performance management, transportation optimization, logistics insights, global visibility, process efficiency, supplier compliance, accrual management, freight payment automation, real-time data, transportation costs, freight payment processing, spot quote management, analytics and reporting, financial management, automated claims processing, invoice auditing, supply chain optimization, carrier payment, market analysis, logistics technology, data-driven insights, rfp management, contract management, accessorial cost mitigation, transportation network performance, global shipping solutions, supply chain strategy, supplier relationships, data management solutions, market visibility, continuous improvement, client-focused services, transportation risk assessment, custom analytics, freight rate management, cross-border logistics, transportation strategy, freight cost monitoring, saas, e-commerce, finance, distribution, consumer products & retail, logistics & supply chain, analytics, mechanical or industrial engineering, health care, health, wellness & fitness, hospital & health care, computer software, consumer internet, consumers, internet, financial services",http://www.linkedin.com/in/jason-westigard-660268,https://traxtech.com,http://www.linkedin.com/company/trax-tech,https://facebook.com/TraxTechnologiesInc/,http://twitter.com/TraxTech,Cedar Park,Texas,United States,"909 Lake Carolyn Pkwy, Irving, Texas, United States, 75039-3390",Irving,Texas,United States,'+1 800-755-0110,"Outlook, Microsoft Office 365, LearnDash, Jira, Atlassian Confluence, Drift, The Trade Desk, BambooHR, Hubspot, Slack, Google Tag Manager, DoubleClick Conversion, Facebook Custom Audiences, Bootstrap Framework, AngularJS, Google AdWords Conversion, Google Dynamic Remarketing, DoubleClick, Bootstrap Framework v3.2.0, Facebook Login (Connect), Mobile Friendly, Linkedin Marketing Solutions, Google Font API, Google Analytics, YouTube, Linkedin Widget, Facebook Widget, Linkedin Login, Remote, AI, Informatica PowerCenter, Informatica Intelligent Cloud Services (IICS), Playwright, Jenkins, GitHub Actions, Oracle Analytics Cloud, PostgreSQL, HTML Pro, CSS, Javascript, Angular, Spring Boot, Hibernate, Nagios, Datadog, Zabbix, Webtraxs, Smartsheet, Microsoft Excel, Confluence, Notion, SharePoint",30000000,24700000,Venture (Round not Specified),9700000,2023-06-01T00:00:00+00:00,Strattam Capital (strattam.com),Strattam Capital (strattam.com),"",false,false,false,false,"",69e3b861b006300011fb7856,69e3b861b006300011fb7862,"","","","","","","","","",""
Heather,Kosztowny,Vice President of Data Science and Data Engineering,Everstream Analytics,Everstream Analytics,heather.kosztowny@everstream.ai,Verified,Apollo,Apollo,"","",2026-03-23T15:02:22+00:00,Vp,"Engineering & Technical, Information Technology","Data Science, Engineering & Technical, Software Development, Infrastructure",simbaaa.1205@gmail.com,"","","",'+1 800-645-8480,"",false,Cold,logistics_people_gap,"",simbaaa.1205@gmail.com,210,logistics & supply chain,"logistics, supply chain risk, supply chain risk management, supply chain discovery, supply chain visibility, multitier mapping, machine learning, multitier visibility, supply chain resilience, ai, business continuity planning, supply chain resiliency, transportation, logistics, supply chain & storage, geopolitical risk assessment, supply chain monitoring, operational risk management, supply chain intelligence platform, event monitoring, artificial intelligence, critical mineral risk, logistics risk management, supply chain disruption prevention, supply chain decision support, risk assessment, real-time monitoring, global supply chain, supply chain event monitoring, supply chain resilience tools, supply chain sustainability, data science, risk prediction, supply chain transparency, supply chain management software, supplier risk assessment, supply chain data integration, supply chain risk prediction, supply chain mapping, trade compliance analytics, other scientific and technical consulting services, supply chain data enrichment, b2b, automation, distribution, supply chain disruption alerts, food and beverage, data integration, supply chain planning, supply chain risk mitigation, supply chain event impact, supply chain data science, predictive analytics, automotive, supply chain optimization, intermodal logistics data, supply chain cost savings, ai-driven insights, risk scoring, consumer goods, supply chain performance, sub-tier supplier visibility, weather impact analysis, supply chain analytics software, disruption mitigation, climate risk scores, government, cybersecurity in supply chain, energy, port operation analytics, regulatory compliance, supply chain intelligence, supply chain visibility tools, retail, supply chain analytics solutions, graph technology, supply chain risk assessment, supply chain risk management software, energy & utilities, supply chain risk scoring, manufacturing, supply chain analytics, healthcare, cybersecurity, multi-tier supply chain mapping, supply chain efficiency analytics, process optimization, transportation & logistics, supply chain analytics platform, services, trade data anomaly detection, material shortage prediction, consulting, event detection, supply chain network analysis, carbon emission reporting, esg reporting, weather intelligence, multi-tier visibility, actionable insights, integrations, automated detection, logistics optimization, data enrichment, sustainability tracking, operational risk, material cost projections, transportation planning, network mapping, cold chain logistics, freight analytics, business resilience, crisis management, inventory strategy, supplier relationship management, incident alerts, data transparency, automation solutions, performance optimization, corporate social responsibility, advanced risk metrics, supplier auditing, analytics integration, competitive advantage, sub-tier supplier management, freight rate optimization, compliance monitoring, trade regulations, environmental impact, risk mitigation strategies, consumer_products_retail, transportation_logistics, energy_utilities, information technology & services, logistics & supply chain, food & beverages, consumers, enterprise software, enterprises, computer software, mechanical or industrial engineering, health care, health, wellness & fitness, hospital & health care, analytics",http://www.linkedin.com/in/kriegerh,https://everstream.ai,http://www.linkedin.com/company/everstreamai,https://facebook.com/pages/Stormpulse/42784217096,https://twitter.com/stormpulse,Edenton,North Carolina,United States,"251 North City Dr, San Marcos, California, United States, 92078",San Marcos,California,United States,'+1 800-645-8480,"Cloudflare DNS, Outlook, Marketo, Microsoft Office 365, Grafana, Atlassian Cloud, React Redux, Barracuda Networks, MongoDB, Figma, Zendesk, WordPress.org, Hotjar, Google Tag Manager, Linkedin Marketing Solutions, Multilingual, Mobile Friendly, Remote, AI, Domo, Sisense, KNIME, QuickBooks, Python, SQL, Salesforce",3661000,105050000,Series B,50000000,2023-04-01T00:00:00+00:00,Everstream (everstream.com.br),Everstream (everstream.com.br),"",false,false,false,false,"",69e3b861b006300011fb7857,69e3b861b006300011fb7863,"","","","","","","","","",""
Charles,Dickerson,VP of Engineering,Shipwell,Shipwell,charles@shipwell.com,Verified,Apollo,Apollo,"",Not Catch-all,2026-04-14T10:58:23+00:00,Vp,"Engineering & Technical, Information Technology","Engineering & Technical, Software Development, Infrastructure",simbaaa.1205@gmail.com,"","","",'+1 512-333-0898,"",false,Cold,logistics_people_gap,"",simbaaa.1205@gmail.com,200,logistics & supply chain,"tracking, freight, big data, transportation management software, logistics, saas, trucking, integrations, procurement, analytics, transportation management, machine learning, shipping, marketplace, supply chain visibility, intelligent market pricing, internet technology, managed transportation services, supply chain, tms, workflow automation, integrated network, multimodal shipment planning, mobile, e-commerce, big data analytics, predictive analytics, enterprise software, information technology, consumer internet, software, internet, transportation, logistics, supply chain & storage, automated settlements, b2b, supply chain automation, manufacturing, carrier relationship management, retail, pricing intelligence, ai in logistics, multimodal visibility, ai-powered freight workflows, risk management, dynamic dock scheduling, ai-driven supply chain, transportation management system, data reporting and analytics, load optimization, operational efficiency, multimodal transportation management, real-time visibility, dock scheduling software, services, distribution, freight optimization, transportation & logistics, unified data insights, rfp automation, freight transportation arrangement, d2c, enterprises, computer software, information technology & services, artificial intelligence, logistics & supply chain, consumers, mechanical or industrial engineering",http://www.linkedin.com/in/charles-dickerson-93769b1,https://shipwell.com,http://www.linkedin.com/company/shipwell,https://www.facebook.com/Shipwellinc/,https://twitter.com/shipwell,Austin,Texas,United States,"3575 Far West Blvd, Austin, Texas, United States, 78755-5001",Austin,Texas,United States,'+1 512-333-0898,"Salesforce, Cloudflare DNS, Route 53, Gmail, Google Apps, Zendesk, Amazon AWS, React Redux, React, Mapbox, MongoDB, Hubspot, Slack, Google Tag Manager, Segment.io, Mobile Friendly, Intercom, Vimeo, Google Maps, Google Font API, FullStory, Android, Remote, AI, AWS Trusted Advisor, Langchain",100000000,47000000,Series B,35000000,2019-10-01T00:00:00+00:00,"","","",false,false,false,false,"",69e3b5ac21e22d0019b04b88,69e3b5ac21e22d0019b04b91,"","","","","","","","","",""
Lu,Saenz,Chief Technology Officer,Flock Freight,Flock Freight,lsaenz@flockfreight.com,Verified,Apollo,Apollo,"",Catch-all,2026-04-17T11:12:37+00:00,C suite,"C-Suite, Engineering & Technical","Information Technology Executive, Engineering & Technical, Technology Operations",simbaaa.1205@gmail.com,"","","",'+1 855-744-7585,"",false,Cold,logistics_people_gap,"",simbaaa.1205@gmail.com,430,logistics & supply chain,"transportation, logistics, supply chain & storage, manufacturing, freight industry standards, multi-shipment optimization, cost savings, b corp, real-time quoting, green freight solutions, freight tracking software, freight data analytics, carbon footprint, freight reliability, sustainable supply chain, freight capacity, freight safety standards, freight safety, inventory management, disruptive logistics platform, operational efficiency, freight booking, freight transportation arrangement, logistics innovation, freight industry disruption, distribution, freight emissions, freight cost reduction, carrier partnerships, shared truckload, freight market trends, supply chain management, patented freight pooling, truck utilization, freight optimization, freight route optimization, freight industry technology, freight visibility, freight capacity pooling, freight compliance, enterprise logistics, freight environmental impact, freight route algorithms, route optimization, freight network, transportation management, freight cost analysis, freight technology solutions, flockdirect, shipment tracking, freight cost efficiency, freight technology, multi-stop routes, tms integration, enterprise shippers, terminal-free routes, b2b, reliable freight, freight logistics platform, freight solutions, transportation & logistics, freight sustainability metrics, freight industry sustainability, freight efficiency tools, ai-powered optimization, freight market, freight pooling technology, logistics automation, freight quotes, b corporation, freight reliability improvements, green logistics, sustainability, freight platform integration, services, emissions reduction, freight platform, logistics technology, capacity utilization, real-time tracking, route efficiency, e-commerce, freight industry growth, freight industry leader, ai optimization, freight management system, cost reduction, multi-stop truckload, multi-stop routing, freight efficiency, real-time freight matching, retail & consumer goods, digital freight, freight damage reduction, truckload service, freight consolidation, freight logistics, freight analytics, api integration, machine learning, freight emissions reduction, energy & utilities, customer experience, freight tracking, automated routing, supply chain efficiency, route planning, supply chain transparency, ai-driven freight matching, freight shipping platform, freight industry transformation, sustainable freight, freight service quality, edi compatibility, freight service, freight capacity management, disruptive freight, freight safety protocols, retail, freight industry innovation, carbon emission reduction, freight pooling, freight emissions tracking, carrier network, big data, freight shipping, less than truckload, full truckload, supply chain optimization, terminal-free shipping, reliable delivery, reduce carbon emissions, customer support, on-time delivery, advanced tracking visibility, api integrations, edi integrations, contracted rates, freight insurance, freight class guide, multi-stop loads, dedicated support, damage reduction, fleet optimization, logistics platform, transportation management system, freight transportation, shipping solutions, eco-friendly shipping, shipping technology, on-demand shipping, freight market insights, automated shipping quotes, shippers platform, carriers platform, contracted freight rates, freight cost management, customer testimonials, industry specific services, food and beverage shipping, machinery transport, consumer products & retail, logistics & supply chain, mechanical or industrial engineering, environmental services, renewables & environment, consumer internet, consumers, internet, information technology & services, artificial intelligence, enterprise software, enterprises, computer software",http://www.linkedin.com/in/lu-saenz,https://flockfreight.com,http://www.linkedin.com/company/flock-freight,https://www.facebook.com/flockfreight/,https://twitter.com/FlockFreight,Encinitas,California,United States,"701 South Coast Highway 101, Encinitas, California, United States, 92024",Encinitas,California,United States,'+1 855-744-7585,"Salesforce, Cloudflare DNS, Rackspace MailGun, Gmail, Google Apps, Microsoft Office 365, accessiBe, WP Engine, Atlassian Cloud, React Redux, React, Webflow, Slack, Hubspot, Google Tag Manager, Segment.io, FullStory, Mobile Friendly, Remote, Salesforce Sales Cloud, Salesforce Service Cloud, Copado, Gearset, AutoRABIT, Git, NetSuite, Google Workspace, Google Analytics, Coda, Celigo, Okta, GitHub, Jira Service Management, Flow, Tipalti, UKG, Snowflake, ANGEL LMS",646500000,515000000,Series E,113500000,2025-08-01T00:00:00+00:00,"","","",false,false,false,false,"",69e3b861b006300011fb785a,69e3b861b006300011fb7865,"","","","","","","","","",""
